focus,product_name,product_one_liner,description,product_url,keywords,id
Data Management,Delta Lake UniForm,"High-performance, format-agnostic storage for your open data lakehouse","Delta Lake UniForm unifies the data in your lakehouse, across all formats and types, for all your analytics and AI workloads.

Open across formats: Use your existing analytics and AI tools, regardless of open data format. UniForm automatically and instantly translates across formats, so you can keep a single copy of source data and still use your favorite Iceberg or Hudi client to read your Delta tables through the Unity Catalog endpoint. With UniForm, your data stays portable, with no vendor lock-in.

Connected across ecosystems: Delta Lake has a vast connector ecosystem and supports multiple frameworks and languages. Delta Sharing is the industry’s first open protocol for secure data sharing, making it simple to share data with other organizations regardless of where the data lives. Native integration with Unity Catalog allows you to centrally manage and audit shared data across organizations. This lets you confidently share data assets with suppliers and partners for better coordination of your business while meeting security and compliance needs. And through integrations with leading tools and platforms, you can visualize, query, enrich and govern shared data from your tools of choice.

Fast and reliable performance: Delta Lake delivers massive scale and speed, with data loads and queries running up to 1.7x faster than with other storage formats. Used in production by over 10,000 customers, Delta Lake scales to process over 40 million events per second in a single pipeline. More than 5 exabytes/day are processed using Delta Lake.
When UniForm is enabled on Delta Lake tables, writing other format metadata does not compromise on query performance. UniForm tables deliver read performance on par with proprietary formats in their native engines.

AI-driven for best price/performance: The Databricks Data Intelligence Platform optimizes your data based on your usage patterns. AI-driven performance enhancements — powered by DatabricksIQ, the Data Intelligence Engine for Databricks — automatically administer, configure and tune your data.
Liquid clustering delivers the performance of a well-tuned, well-partitioned table without the traditional headaches that come with partitioning, such as worrying about whether you can partition high-cardinality columns or expensive rewrites when changing partition columns. The result is lightning-fast, well-clustered tables with minimal configuration. Predictive optimization automatically optimizes your data for the best performance and price. It learns from your data usage patterns, builds a plan for the right optimizations to perform, and then runs those optimizations on hyper-optimized serverless infrastructure.

Security and governance at scale: Delta Lake reduces risk by enabling fine-grained access controls for data governance, functionality typically not possible with data lakes. You can quickly and accurately update data in your data lake to comply with regulations like GDPR and maintain better data governance through audit logging. These capabilities are natively integrated and enhanced on Databricks as part of the Unity Catalog, the first multicloud data catalog for the lakehouse.

Automated and trusted data engineering: Simplify data engineering with Delta Live Tables — an easy way to build and manage data pipelines for fresh, high-quality data on Delta Lake. It helps data engineering teams by simplifying ETL development and management with declarative pipeline development, improved data reliability and cloud-scale production operations to help build the lakehouse foundation.

Use Cases are as follows:
1. BI on your data: Make new, real-time data instantly available for querying by data analysts for immediate insights on your business by running business intelligence workloads directly on your data lake. Delta Lake allows you to operate a multicloud lakehouse architecture that provides data warehousing performance at data lake economics for up to 6x better price/performance for SQL workloads than traditional cloud data warehouses.
2. Unify batch and streaming: Run both batch and streaming operations on one simplified architecture that avoids complex, redundant systems and operational challenges. In Delta Lake, a table is both a batch table and a streaming source and sink. Streaming data ingest, batch historic backfill and interactive queries all work out of the box and directly integrate with Spark Structured Streaming.
3. Meet regulatory needs: Delta Lake removes the malformed data ingestion challenges, difficulty deleting data for compliance, and issues modifying data for change data capture. With support for ACID transactions on your data lake, Delta Lake ensures that every operation either fully succeeds or fully aborts for later retries — without requiring new data pipelines to be created. Additionally, Delta Lake records all past transactions on your data lake, so it’s easy to access and use previous versions of your data to meet compliance standards like GDPR and CCPA reliably.













",https://www.databricks.com/product/delta-lake-on-databricks,"ACID compliance, data reliability, versioning, schema evolution, batch processing, real-time ingestion, ETL workflows, data streaming, scalable architecture, iceberg, hudi

",18
Data Management,DatabricksIQ (Data Intelligence),Out of the box semantic intelligence engine learning the nuances of your data and improving user productivity,"DatabricksIQ is the data intelligence engine powering the Databricks Platform. It is a compound AI system that combines the use of AI models, retrieval, ranking, and personalization systems to understand the semantics of your organization’s data and usage patterns.

DatabricksIQ itself has no end-user UI, but it enables existing product experiences to be more accurate and provide more relevant results such as Databricks Assistant, AI-generated comments, and intelligent search.

These DatabricksIQ-powered features enable everyone in an organization to be more productive using data and AI, while maintaining the governance and controls established in Unity Catalog. Use Databricks Assistant to develop code. Create dashboards with Databricks Assistant. AI-generated table comments in Catalog Explorer. Use Databricks Assistant for help",https://www.databricks.com/product/data-intelligence-platform,"Data Intelligence, Data Semantics, AI-Generated Comments, Intelligent Search",19
Data Warehousing,Databricks SQL,The intelligent Data Warehouse,"Databricks SQL is the intelligent data warehouse. Built with DatabricksIQ, the Data Intelligence Engine that understands the uniqueness of your data, Databricks SQL democratizes analytics for technical and business users alike. Businesses are able to innovate faster with an intelligent and auto-optimizing platform that provides the best price/performance in the market. As part of the Databricks Data Intelligence Platform, Databricks SQL benefits from the simplicity, unified governance and openness of lakehouse architecture.

The best data warehouse is a lakehouse: Databricks SQL is built on lakehouse architecture, which unifies data, analytics and AI, eliminating the cost and complexity of a stand-alone, legacy data warehouse and lowering TCO. Delta Lake UniForm serves as the open storage layer for all your data in one place, and Unity Catalog provides unified security and governance.

Access for everyone to ask questions of their data: DatabricksIQ powers multiple intelligent experiences that give anyone a simple interface to ask questions and get insights from their data. Data engineers and data scientists who write code have an assistant inside the SQL editor, and analysts have an assistant to generate visualizations for their dashboards.

Intelligent, automated management and tuning: Databricks applies machine learning, powered by DatabricksIQ, to all levels of our stack to automatically improve efficiency and performance for your workloads. This eliminates the need for admins to worry about the management minutia and improves savings through more efficient provisioning.

World-class price/performance: Databricks SQL utilizes our next-generation vectorized query engine Photon and set the world-record 100TB TPC-DS benchmark. For BI workloads, the instant, elastic SQL compute — decoupled from storage — will automatically scale to provide unlimited concurrency.





",https://www.databricks.com/product/databricks-sql,"SQL analytics, BI tools, dashboards, serverless compute, interactive queries, real-time insights, visualization, federated queries, Vectorized query processing, Photon, optimized analytics, low latency, cost optimization, data parallelism, hardware acceleration",20
Data Warehousing,AI Functions,The power of GenAI for SQL users,"Databricks AI Functions, built-in SQL functions that allow you to apply AI on your data directly from SQL.

SQL is crucial for data analysis due to its versatility, efficiency, and widespread use. Its simplicity enables swift retrieval, manipulation, and management of large datasets. Incorporating AI functions into SQL for data analysis enhances efficiency, which enables businesses to swiftly extract insights.

Integrating AI into analysis workflows provides access to information previously inaccessible to analysts, and empowers them to make more informed decisions, manage risks, and sustain a competitive advantage through data-driven innovation and efficiency. These functions invoke a state-of-the-art generative AI model from Databricks Foundation Model APIs to perform tasks such as sentiment analysis, classification, and translation. See Analyze customer reviews using AI Functions like ai_analyze_sentiment, ai_classify ,ai_extract ,ai_fix_grammar ,ai_gen,ai_mask,ai_similarity,ai_summarize
,ai_translate. The ai_query() function allows you to query machine learning models and large language models served using Mosaic AI Model Serving. The vector_search() function allows you to search and query a Mosaic AI Vector Search index using SQL.. The ai_forecast() function is a table-valued function designed to extrapolate time series data into the future. In its most general form, ai_forecast() accepts grouped, multivariate, or mixed-granularity data, and forecasts that data up to some horizon in the future.",https://docs.databricks.com/en/large-language-models/ai-functions.html,"sql functions, forecasting, translating, analyzing",21
Real Time Analytics,Data Streaming,"Real-time analytics, ML and applications made simple
Get started
","The Databricks Data Intelligence Platform dramatically simplifies data streaming to deliver real-time analytics, machine learning and applications on one platform.
Enable your data teams to build streaming data workloads with the languages and tools they already know. Simplify development and operations by automating the production aspects associated with building and maintaining real-time data workloads. Eliminate data silos with a single platform for streaming and batch data.

1. Build streaming pipelines and applications faster: Use the languages and tools you already know with unified batch and streaming APIs in SQL and Python. Unlock real-time analytics, ML and applications for the entire organization.
2. Simplify operations with automated tooling: Easily deploy and manage your real-time pipelines and applications in production. Automated tooling simplifies task orchestration, fault tolerance/recovery, automatic checkpointing, performance optimization, and autoscaling.
3. Unify governance for all your real-time data across clouds: Unity Catalog delivers one consistent governance model for all your streaming and batch data, simplifying how you discover, access and share real-time data.

How it works:
1. Streaming data ingestion and transformation
Simplify data ingestion and ETL for streaming data pipelines with Delta Live Tables. Leverage a simple declarative approach to data engineering that empowers your teams with the languages and tools they already know, like SQL and Python. Build and run your batch and streaming data pipelines in one place with controllable and automated refresh settings, saving time and reducing operational complexity. No matter where you plan to send your data, building streaming data pipelines on the Databricks Data Intelligence Platform ensures you don’t lose time between raw and cleaned data.
2. Real-time analytics, ML and applications
With streaming data, immediately improve the accuracy and actionability of your analytics and AI. Your business benefits from real-time insights as a downstream impact of streaming data pipelines. Whether you’re performing SQL analytics and BI reporting, training your ML models or building real-time operational applications, give your business the freshest data possible to unlock real-time insights, more accurate predictions and faster decision-making to stay ahead of the competition.
3. Automated operational tooling
As you build and deploy streaming data pipelines, Databricks automates many of the complex operational tasks required for production. This includes automatically scaling the underlying infrastructure, orchestrating pipeline dependencies, error handling and recovery, performance optimization and more. Enhanced Autoscaling optimizes cluster utilization by automatically allocating compute resources for each unique workload. These capabilities along with automatic data quality testing and exception management help you spend less time on building and maintaining operational tooling so you can focus on getting value from your data.
4. Next-generation stream processing engine
Spark Structured Streaming is the core technology that unlocks data streaming on the Databricks Data Intelligence Platform, providing a unified API for batch and stream processing. Databricks is the best place to run your Apache Spark workloads with a managed service that has a proven track record of 99.95% uptime. Your Spark workloads are further accelerated by Photon, the next-generation engine compatible with Apache Spark APIs delivering record-breaking performance-per-cost while automatically scaling to thousands of nodes.
5. Unified governance and storage
Data streaming on Databricks means you benefit from the foundational components of the Databricks Data Intelligence Platform — Unity Catalog and Delta Lake. Your raw data is optimized with Delta Lake, the only open source storage framework designed from the ground up for both streaming and batch data. Unity Catalog gives you fine-grained, integrated governance for all your data and AI assets with one consistent model to discover, access and share data across clouds. Unity Catalog also provides native support for Delta Sharing, the industry’s first open protocol for simple and secure data sharing with other organizations.




",https://www.databricks.com/product/data-streaming,"real time analytics, streaming, near real time, observability ",22
Data Engineering,Data Engineering,Production Ready Data Pipelines for analytics and AI,"Easily ingest and transform batch and streaming data on the Databricks Data Intelligence Platform. Orchestrate reliable production workflows while Databricks automatically manages your infrastructure at scale and provides you with unified governance. Accelerate innovation by increasing your team’s productivity with a built-in, AI-powered intelligence engine that understands your data and your pipelines.
1. Trustworthy data from reliable pipelines: Built-in data quality validation and proven platform reliability help data teams ensure data is correct, complete and fresh for downstream use cases.
2. Optimized cost/performance: Serverless lakehouse architecture with data intelligence automates the complex operations behind building and running pipelines, taking the guesswork and manual overhead out of optimizations.
3. Democratized access to data: Designed to empower data practitioners to manage batch or streaming pipelines — ingesting, transforming and orchestrating data according to their technical aptitude, preferred interface and need for fine-tuning — all on a unified platform.
4. Build on the Data Intelligence Platform: The Data Intelligence Platform provides the best foundation for building and sharing trusted data assets that are centrally governed, reliable and lightning fast

Managed data pipelines: Data needs to be ingested and transformed so it’s ready for analytics and AI. Databricks provides powerful data pipelining capabilities for data engineers, data scientists and analysts with Delta Live Tables. DLT is the first framework that uses a simple declarative approach to build data pipelines on batch or streaming data while automating operational complexities such as infrastructure management, task orchestration, error handling and recovery, and performance optimization. With DLT, engineers can also treat their data as code and apply software engineering best practices like testing, monitoring and documentation to deploy reliable pipelines at scale.

Unified workflow orchestration: Databricks Workflows offers a simple, reliable orchestration solution for data and AI on the Data Intelligence Platform. Databricks Workflows lets you define multistep workflows to implement ETL pipelines, ML training workflows and more. It offers enhanced control flow capabilities and supports different task types and triggering options. As the platform-native orchestrator, Databricks Workflows also provides advanced observability to monitor and visualize workflow execution along with alerting capabilities for when issues arise. Serverless compute options allow you to leverage smart scaling and efficient task execution.

Powered by data intelligence: DatabricksIQ is the Data Intelligence Engine that brings AI into every part of the Data Intelligence Platform to boost data engineers’ productivity through tools such as Databricks Assistant. Utilizing generative AI and a comprehensive understanding of your Databricks environment, Databricks Assistant can generate or explain SQL or Python code, detect issues, and suggest fixes. DatabricksIQ also understands your pipelines and can optimize them using intelligent orchestration and flow management, providing you with serverless compute.

Next-generation data streaming engine: Apache Spark™ Structured Streaming is the most popular open source streaming engine in the world. It is widely adopted across organizations in open source and is the core technology that powers streaming data pipelines on Databricks, the best place to run Spark workloads. Spark Structured Streaming provides a single, unified API for batch and stream processing, making it easy to implement streaming data workloads without changing code or learning new skills. Easily switch between continuous and triggered processing to optimize for latency or cost.

State-of-the-art data governance, reliability and performance: Data engineering on Databricks means you benefit from the foundational components of the Data Intelligence Platform — Unity Catalog and Delta Lake. Your raw data is optimized with Delta Lake, an open source storage format providing reliability through ACID transactions, and scalable metadata handling with lightning-fast performance. This combines with Unity Catalog, which gives you fine-grained governance for all your data and AI assets, simplifying how you govern, with one consistent model to discover, access and share data across clouds. Unity Catalog also provides native support for Delta Sharing, the industry’s first open protocol for simple and secure data sharing with other organizations.








",https://www.databricks.com/solutions/data-engineering,"Data pipelines, Data Engineering, automated quality checks, monitoring, production-ready pipelines, ETL, data governance, lineage tracking",23
Data Engineering,Delta Live Tables,Reliable Data Pipelines made easy,"Reliable data pipelines made easy
Delta Live Tables (DLT) is a declarative ETL framework for the Databricks Data Intelligence Platform that helps data teams simplify streaming and batch ETL cost-effectively. Simply define the transformations to perform on your data and let DLT pipelines automatically manage task orchestration, cluster management, monitoring, data quality and error handling.

Efficient data ingestion:
Building production-ready ETL pipelines begins with ingestion. DLT powers easy, efficient ingestion for your entire team — from data engineers and Python developers to data scientists and SQL analysts. With DLT, load data from any data source supported by Apache Spark™ on Databricks. 
Use Auto Loader and streaming tables to incrementally land data into the Bronze layer for DLT pipelines or Databricks SQL queries
Ingest from cloud storage, message buses and external systems
Use change data capture (CDC) in DLT to update tables based on changes in source data

Intelligent, cost-effective data transformation
From just a few lines of code, DLT determines the most efficient way to build and execute your streaming or batch data pipelines, optimizing for price/performance (nearly 4x Databricks baseline) while minimizing complexity.
Instantly implement a streamlined medallion architecture with streaming tables and materialized views
Optimize data quality for maximum business value with features like expectations
Refresh pipelines in continuous or triggered mode to fit your data freshness needs

Simple pipeline setup and maintenance:
DLT pipelines simplify ETL development by automating away virtually all the inherent operational complexity. With DLT pipelines, engineers can focus on delivering high-quality data rather than operating and maintaining pipelines. DLT automatically handles:
Task orchestration
CI/CD and version control
Autoscaling compute infrastructure for cost savings
Monitoring via metrics in the event log
Error handling and failure recovery

Next-gen stream processing engine:
Spark Structured Streaming is the core technology that unlocks streaming DLT pipelines, providing a unified API for batch and stream processing. DLT pipelines leverage the inherent subsecond latency of Spark Structured Streaming, and record-breaking price/performance. Although you can manually build your own performant streaming pipelines with Spark Structured Streaming, DLT pipelines may provide faster time to value, better ongoing development velocity, and lower TCO because of the operational overhead they automatically manage.

Unified data governance and storage:
Running DLT pipelines on Databricks means you benefit from the foundational components of the Data Intelligence Platform built on lakehouse architecture — Unity Catalog and Delta Lake. Your raw data is optimized with Delta Lake, the only open source storage framework designed from the ground up for both streaming and batch data. Unity Catalog gives you fine-grained, integrated governance for all your data and AI assets with one consistent model to discover, access and share data across clouds. Unity Catalog also provides native support for Delta Sharing, the industry’s first open protocol for simple and secure data sharing with other organizations.

DLT pipelines are made of the two fundamental building blocks of Streaming Tables and Materialized Views. They are built on the reliable standards of Delta Tables and Spark Structured Streaming. 
ETL workloads are the foundation of analytics and AI initiatives and typically account for 50% or more of an organization’s overall data costs. The rapid rise of LLMs and other AI applications is forcing companies to take a closer look at how to scale in a cost-efficient manner. Customers overwhelmingly report significant return on their investment in DLT for several reasons: 

Inherent cost-effectiveness of Delta Lake with a purpose-built storage format for batch and streaming data
Intelligent and efficient serverless autoscaling designed to handle all ETL workloads and minimize compute cost
Significantly reduced overhead due to minimal time and effort required for pipeline creation, management and data team synchronization
Operational efficiencies like automatic performance optimization, automatic recovery on failure, automatic data quality testing, out-of-the-box monitoring and observability










",https://www.databricks.com/product/delta-live-tables,"Data pipelines, Data Engineering, automated quality checks, monitoring, production-ready pipelines, ETL, data governance, lineage tracking",24
