focus,product_name,product_one_liner,description,product_url,keywords,id
Artifical Intelligence,Mosaic AI AI Gateway,Manage and govern all GenAI models across the enterprise,"Manage and govern all GenAI models across the enterprise
Secure access to any AI model: Mosaic AI Gateway protects your data and GenAI deployments through centralized governance across all models in your enterprise. With support for any model endpoint, including Azure OpenAI, Amazon Bedrock on AWS, and Meta Llama 3, AI Gateway allows you to tap into cutting-edge innovations through a single, powerful query interface. With AI Gateway you can easily test and swap new models without requiring changes to your codebase. It captures usage tracking in Unity Catalog, with permissions enforced to prevent sensitive data leaks. Additionally, with real-time spending insights, AI Gateway keeps your finances in check and your operations streamlined.

Unified access to all AI models: Mosaic AI Gateway offers unified access to a wide range of models, including external LLMs like OpenAI and Meta Llama 3, through a single standard query interface. This eliminates the need to maintain separate systems to manage AI traffic. Enterprises can effortlessly switch between foundation and custom models, ensuring uninterrupted pipelines and simplified maintenance.

Advanced security and governance: Adopting GenAI means navigating complex security protocols, data governance standards and access controls. AI Gateway simplifies this by capturing data flowing through model APIs — such as payload logs, usage tracking and guardrail activation — into Unity Catalog for secure storage, sharing and management. With centralized governance and custom guardrails like content filtration and PII detection, it ensures consistent security and compliance across all endpoints, protecting your organization’s most critical information.

Improved model accuracy:
Elevate your model quality with our robust observability tools that capture detailed request and response data. Payload logging enables you to debug, fine-tune and enhance models, improving accuracy and reducing latency. This ensures your AI applications perform at their best and deliver optimal results.

Spending oversight: Our observability tools offer detailed usage tracking and spending oversight. With real-time insights into your AI operations, you can monitor expenses, optimize resource allocation and ensure efficient performance. These tools help you maintain financial control while maximizing the effectiveness of your AI deployments.





",https://www.databricks.com/product/ai-gateway,"Centralized AI governance, curated model catalog, PII protection, cost management, model discovery",8
Artifical Intelligence,Mosaic AI Model Training,Fine Tune and Pretrain your own LLMs and other genrative AI models,"Fine-tune and pretrain your own LLMs and other generative AI models
Fine-tune an open source LLM or build custom LLMs trained on your enterprise data with Mosaic AI Model Training. Custom models built with Model Training are faster, produce higher-quality results that are more domain-specific, and have up to 10x lower costs than proprietary LLMs.

Highly accurate: Fine-tuning an open source LLM or building a new LLM with enterprise data leads to a greater semantic understanding of the business and delivers highly accurate responses. Because Mosaic AI Model Training is natively available in Databricks, organizations can easily and securely fine-tune or build models without moving their data. This also ensures governance, auditability, traceability and monitoring to ensure models are used in the right way and are providing the right responses. The result is higher-quality and accurate results that are specific to the business context.

Effortless scale: A key element to high-performance LLM training is scalability, which requires fast, low-latency networking and access to the highest-performing GPUs. Using Mosaic AI Model Training automatically gives you access to both NVIDIA InfiniBand networking and NVIDIA H100 Tensor Core GPUs, the highest-performing NVIDIA GPUs, which give unprecedented performance and scalability compared to previous hardware generations. This lets you scale to train large (>70 billion-parameter) models easily and complete training runs in hours and days.

Cost-effective: Mosaic AI Model Training can fine-tune smaller open source GenAI LLMs to produce highly efficient models that can be served up to 5x more cost-effectively than larger proprietary LLMs. Additionally, you can build new LLMs from scratch using an optimized software stack that makes training LLMs cost-effective. A combination of system-level optimizations, tuned parallelism strategies and model training science results in a 10x lower cost of training.

Secure and compliant: For most organizations, security is paramount, and they can’t afford to have their employees send their data to a third-party API and risk having the data leaked or used to train a public model. Mosaic AI Model Training ensures that this can never happen, because organizations will build their own LLM where they maintain complete control and ownership over both the data and the model. Everything remains encrypted by default, including traffic and all training data. This ensures you have complete data privacy and full model ownership, meeting any regulatory compliance.




",https://www.databricks.com/product/machine-learning/mosaic-ai-training,"Model finetuning, transfer learning, domain adaptation, model optimization, specialized training, custom datasets, Model pre-training, large-scale training, supervised learning, unsupervised learning, model initialization, deep learning",9
Artifical Intelligence,Mosaic AI Feature Store,The first feature store codesigned with a data platform and MLOPs framework,"The first feature store co-designed with a data platform and MLOps framework
Provide data teams with the ability to create new features, explore and reuse existing ones, publish features to low-latency online stores, build training data sets and retrieve feature values for batch inference.

Features as reusable assets: Feature Registry provides a searchable record of all features, their associated definition, source data, and their consumers, eliminating considerable rework across teams. Data scientists, analysts and ML engineers can search for features based on the consumed raw data and either use features directly or fork existing features.

Consistent features for training and serving: Feature Provider serves the features in two modes. Batch mode provides features at high throughput for training ML models or batch inference. Online mode provides features at low latency for serving ML models or for the consumption of the same features in BI applications. Features used in model training are automatically tracked with the model and, during model inference, the model itself retrieves them directly from the feature store.

Secure features with built-in governance: Feature store integrations provide the full lineage of the data used to compute features. Features have associated ACLs to ensure the right level of security. Integration with MLflow ensures that the features are stored alongside the ML models, eliminating drift between training and serving time.

",https://www.databricks.com/product/feature-store,"Feature Engineering, Data Lineage, Simplified Deployment, Automated Feature Sharing, Model Training",10
Artifical Intelligence,Mosaic AI Evaluation,Out of the box evaluation capabilities for GenAI,"Tools to assess AI systems, combining automated LLM judges and human evaluations to ensure high-quality, accurate model responses and functionality.",https://docs.databricks.com/en/generative-ai/agent-evaluation/index.html,"Agent evaluation, quality metrics, golden examples, debugging, LLM judges, production assessments, AI system evaluation, quality metrics, human feedback, performance debugging, MLflow Tracing",11
Artifical Intelligence,Mosaic AI AutoML,Augment Experts. Empower Citizen Data Scientists,"Augment experts. Empower citizen data scientists.
Databricks AutoML allows you to quickly generate baseline models and notebooks. ML experts can accelerate their workflow by fast-forwarding through the usual trial-and-error and focus on customizations using their domain knowledge, and citizen data scientists can quickly achieve usable results with a low-code approach.

Jump-start new ML projects: Databricks AutoML provides the training code for every trial run to help data scientists jump-start their development. Data scientists can use this to quickly assess the feasibility of using a data set for machine learning (ML) or to get a quick sanity check on the direction of an ML project.

No ML problem too big: Leverage AutoML to tackle a variety of machine learning problems ranging from classification, regression, and forecasting. AutoML uses multiple algorithms from a variety of machine learning libraries for each problem type, and lets you pick the best for your problem.

Automate the grind of machine learning: Automatically set up your machine learning project with the training libraries, MLflow integration for experiment tracking and built-in ML best practices such as training and testing split, normalizing of features and hyperparameter tuning.

A glass box approach to AutoML: Use generated editable notebooks to easily customize baseline models with your domain expertise. You can also leverage these notebooks to explain how your AutoML models were trained to fulfill audit and compliance requirements.







",https://www.databricks.com/product/automl,"AutoML, feature engineering, hyperparameter optimization, explainability, user-guided automation, deployment-ready models, model evaluation",12
Artifical Intelligence,Mosaic AI Playground,Test new foundation models for your applications with a click,"AI playground presents the latest GenAI models for a side by side comparision for your prompts and your data. It provides summarization experiements, function calling experiments, Q&A experiements. It also provides integrated AI judges and synthetic question generation",null,"AI, GenAI, Experiments",13
Artifical Intelligence,Lakehouse Monitoring,Intelligend data and model monitoring,"Intelligent data and model monitoring
Databricks Lakehouse Monitoring allows teams to monitor their entire data pipelines — from data and features to ML models — without additional tools and complexity. Powered by Unity Catalog, it lets users uniquely ensure that their data and AI assets are high quality, accurate and reliable through deep insight into the lineage of their data and AI assets. The single, unified approach to monitoring enabled by lakehouse architecture makes it simple to diagnose errors, perform root cause analysis and find solutions.

Proactive reporting: Proactive and simplified detection of anomalies in your data and models, reducing time to market and operational costs incurred due to inefficiencies.

Unified tooling from data to ML: Gain complete visibility into all your data and models in a matter of minutes. The auto-generated metrics enable you to measure the impact of your data and ML products more effectively right out of the box.

Automated root cause analysis: Seamlessly debug data and model quality issues by tracing root cause back to the anomalies. Capabilities such as automated root cause analysis mean less time to value and higher efficiencies in your production pipelines.



",https://www.databricks.com/product/machine-learning/lakehouse-monitoring,"Monitoring, Drift, Bias, Alerting",14
Artifical Intelligence,Mosaic AI Managed Mlflow,Build better models and generative AI apps,"Build better models and generative AI apps
Managed MLflow extends the functionality of MLflow, an open source platform developed by Databricks for building better models and generative AI apps, focusing on enterprise reliability, security and scalability. The latest update to MLflow introduces innovative GenAI and LLMOps features that enhance its capability to manage and deploy large language models (LLMs). This expanded LLM support is achieved through new integrations with industry-standard LLM tools OpenAI and Hugging Face Transformers — as well as the MLflow Deployments Server. Additionally, MLflow’s integration with LLM frameworks (e.g., LangChain) enables simplified model development for creating generative AI applications for a variety of use cases, including chatbots, document summarization, text classification, sentiment analysis and beyond.

Model development: Enhance and expedite machine learning lifecycle management with a standardized framework for production-ready models. Managed MLflow Recipes enable seamless ML project bootstrapping, rapid iteration and large-scale model deployment. Craft applications like chatbots, document summarization, sentiment analysis and classification effortlessly. Easily develop generative AI apps (e.g., chatbots, doc summarization) with MLflow’s LLM offerings, which seamlessly integrate with LangChain, Hugging Face and OpenAI.

Experiment tracking: Run experiments with any ML library, framework or language, and automatically keep track of parameters, metrics, code and models from each experiment. By using MLflow on Databricks, you can securely share, manage and compare experiment results along with corresponding artifacts and code versions — thanks to built-in integrations with the Databricks workspace and notebooks. You will also be able to evaluate the results of GenAI experiments and improve quality with MLflow evaluation functionality.

Model management: Use one central place to discover and sh are ML models, collaborate on moving them from experimentation to online testing and production, integrate with approval and governance workflows and CI/CD pipelines, and monitor ML deployments and their performance. The MLflow Model Registry facilitates sharing of expertise and knowledge, and helps you stay in control.

Model deployment: Quickly deploy production models for batch inference on Apache Spark™ or as REST APIs using built-in integration with Docker containers, Azure ML or Amazon SageMaker. With Managed MLflow on Databricks, you can operationalize and monitor production models using Databricks jobs scheduler and auto-managed clusters to scale based on the business needs. The latest upgrades to MLflow seamlessly package GenAI applications for deployment. You can now deploy your chatbots and other GenAI applications such as document summarization, sentiment analysis and classification at scale, using Databricks Model Serving.

Features in MLFlow Tracking:
MLFLOW TRACKING: Automatically log parameters, code versions, metrics, and artifacts for each run using Python, REST, R API, and Java API
GENERATIVE AI DEVELOPMENT: Simplify model development to build GenAI applications for a variety of use cases such as chatbots, document summarization, sentiment analysis and classification with MLflow’s Deployments Server and Evaluation UI, supported by native integration with LangChain, and seamless UI for fast prototyping and iteration.
MLFLOW TRACKING SERVER: Get started quickly with a built-in tracking server to log all runs and experiments in one place. No configuration needed on Databricks.
EXPERIMENT MANAGEMENT: Create, secure, organize, search and visualize experiments from within the workspace with access control and search queries.
MLFLOW RUN SIDEBAR: Automatically track runs from within notebooks and capture a snapshot of your notebook for each run so that you can always go back to previous versions of your code.
LOGGING DATA WITH RUNS: Log parameters, datasets, metrics, artifacts and more as runs to local files, to a SQLAlchemy compatible database, or remotely to a tracking server.
DELTA LAKE INTEGRATION: Track large-scale datasets that fed your models with Delta Lake snapshots.
ARTIFACT STORE: Store large files such as S3 buckets, shared NFS file system, and models in Amazon S3, Azure Blob Storage, Google Cloud Storage, SFTP server, NFS, and local file paths.


Features in MLflow Models:
MLFLOW MODELS: A standard format for packaging machine learning models that can be used in a variety of downstream tools — for example, real-time serving through a REST API or batch inference on Apache Spark.
MODEL CUSTOMIZATION: Use Custom Python Models and Custom Flavors for models from an ML library that is not explicitly supported by MLflow’s built-in flavors.
BUILT-IN MODEL FLAVORS: MLflow provides several standard flavors that might be useful in your applications, like Python and R functions, Hugging Face, OpenAI and LangChain, PyTorch, Spark MLlib, TensorFlow and ONNX.
BUILT-IN DEPLOYMENT TOOLS: Quickly deploy on Databricks via Apache Spark UDF for a local machine, or several other production environments such as Microsoft Azure ML, Amazon SageMaker, and building Docker Images for Deployment.

Features in MLflow Model Registry: 
CENTRAL REPOSITORY: Register MLflow models with the MLflow Model Registry. A registered model has a unique name, version, stage and other metadata.
MODEL VERSIONING: Automatically keep track of versions for registered models when updated.
MODEL STAGE: Assign preset or custom stages to each model version, like “Staging” and “Production” to represent the lifecycle of a model.
CI/CD WORKFLOW INTEGRATION: Record stage transitions, request, review and approve changes as part of CI/CD pipelines for better control and governance.
MODEL STAGE TRANSITIONS: Record new registration events or changes as activities that automatically log users, changes, and additional metadata such as comments.

Features in MLflow Deployment Server:
GOVERN ACCESS TO LLMS: Manage SaaS LLM credentials.
CONTROL COSTS: Set up rate limits.
STANDARDIZE LLM INTERACTIONS: Experiment with different OSS/SaaS LLMs with standard input/output interfaces for different tasks: completions, chat, embeddings.
















",https://www.databricks.com/product/managed-mlflow,"Experiment tracking, model registry, ML deployment, cross-platform support, AutoML, reproducibility, collaboration, CI/CD integration",15
Business Intelligence,AI/BI Genie,Intelligent analytics for real-world data - converse with your data in natural language,"AI-first BI, native to your data platform
Databricks AI/BI is a new type of business intelligence product built to democratize analytics and insights for anyone in your organization. Powered by data intelligence, AI/BI understands your unique data and business concepts by capturing signals from across your Databricks estate, continuously learning and improving to accurately answer your questions.

AI/BI features two complementary capabilities: Dashboards and Genie. Dashboards provide a low-code experience to help analysts quickly build highly interactive data visualizations for their business teams using natural language, and Genie allows business users to converse with their data to ask questions and self-serve their own analytics.

Databricks AI/BI is native to the Databricks Data Intelligence Platform, providing instant insights at massive scale while ensuring unified governance and fine-grained security are maintained across the entire organization.

1. Intelligent analytics: Powered by AI that understands your real-world data and business semantics, and continuously improves through real-time user feedback.
2. Unified governance and security: With Unity Catalog integration, easily manage access controls and policies. Maintain a single, connected audit trail from source data to dashboard.
3. Instant insights at scale: Experience maximum query efficiency with BI that lives on your data platform — no need to sacrifice performance for scale.

Quickly generate elegant visualizations with Dashboards: AI/BI Dashboards make it easy to create and iterate on visualizations with natural language through AI-assisted authoring. Dashboards offer standard data visualization capabilities including sleek charts, interactions such as cross-filtering, periodic snapshots via email, embedding and more. And they live side by side with your data, delivering instant load and rapid interactive analysis — no matter the data or user scale.

Use Genie to converse with your data: For every new question your dashboard inspires, there’s an AI-powered Genie that lets you drill deeper to understand the why Genie is a powerful conversational experience that lets business teams engage with their data through natural language. Leveraging generative AI tailored to your organization’s unique terminology and data, Genie continuously improves through user feedback, enabling quick, relevant, accurate answers directly from your enterprise data.

Experience analytics built for real-world data: AI/BI is built on a compound AI system architecture, allowing it to automatically understand data structures, associated comments, usage patterns and lineage. AI/BI does not require perfect data or complete pre-modeling to work with messy real-world data. Instead, it adapts to your unique data through usage-based self-improvement and iterative human feedback.

Maintain integrated governance and data lineage: Since AI/BI draws upon the centralized data governance policies established in Unity Catalog, it’s easy to manage access controls and maintain complete lineage from source data to final insight. That means users can easily understand the impact of upstream changes to data pipelines on dashboards while ensuring insights and visualizations are secure by default.

Collaborate and share with ease: Dashboards are optimized for simple, secure sharing. Dashboard owners can securely share with anyone in the organization without providing full workspace access or procuring a license.















",https://www.databricks.com/product/ai-bi,"Intelligent analytics, AI-powered BI, AI/BI Genie, conversational analytics, semantic analysis, low-code solutions",16
Business Intelligence,AI/BI Dashboards,Intelligent analytics for real-world data build and converse with your dashboards in natural language,"AI-first BI, native to your data platform
Databricks AI/BI is a new type of business intelligence product built to democratize analytics and insights for anyone in your organization. Powered by data intelligence, AI/BI understands your unique data and business concepts by capturing signals from across your Databricks estate, continuously learning and improving to accurately answer your questions.

AI/BI features two complementary capabilities: Dashboards and Genie. Dashboards provide a low-code experience to help analysts quickly build highly interactive data visualizations for their business teams using natural language, and Genie allows business users to converse with their data to ask questions and self-serve their own analytics.

Databricks AI/BI is native to the Databricks Data Intelligence Platform, providing instant insights at massive scale while ensuring unified governance and fine-grained security are maintained across the entire organization.

1. Intelligent analytics: Powered by AI that understands your real-world data and business semantics, and continuously improves through real-time user feedback.
2. Unified governance and security: With Unity Catalog integration, easily manage access controls and policies. Maintain a single, connected audit trail from source data to dashboard.
3. Instant insights at scale: Experience maximum query efficiency with BI that lives on your data platform — no need to sacrifice performance for scale.

Quickly generate elegant visualizations with Dashboards: AI/BI Dashboards make it easy to create and iterate on visualizations with natural language through AI-assisted authoring. Dashboards offer standard data visualization capabilities including sleek charts, interactions such as cross-filtering, periodic snapshots via email, embedding and more. And they live side by side with your data, delivering instant load and rapid interactive analysis — no matter the data or user scale.

Use Genie to converse with your data: For every new question your dashboard inspires, there’s an AI-powered Genie that lets you drill deeper to understand the why Genie is a powerful conversational experience that lets business teams engage with their data through natural language. Leveraging generative AI tailored to your organization’s unique terminology and data, Genie continuously improves through user feedback, enabling quick, relevant, accurate answers directly from your enterprise data.

Experience analytics built for real-world data: AI/BI is built on a compound AI system architecture, allowing it to automatically understand data structures, associated comments, usage patterns and lineage. AI/BI does not require perfect data or complete pre-modeling to work with messy real-world data. Instead, it adapts to your unique data through usage-based self-improvement and iterative human feedback.

Maintain integrated governance and data lineage: Since AI/BI draws upon the centralized data governance policies established in Unity Catalog, it’s easy to manage access controls and maintain complete lineage from source data to final insight. That means users can easily understand the impact of upstream changes to data pipelines on dashboards while ensuring insights and visualizations are secure by default.

Collaborate and share with ease: Dashboards are optimized for simple, secure sharing. Dashboard owners can securely share with anyone in the organization without providing full workspace access or procuring a license.















",https://www.databricks.com/product/ai-bi,"Intelligent analytics, AI-powered BI, AI/BI Genie, conversational analytics, semantic analysis, low-code solutions",17
